{
  "schema_version": "1.0",
  "task_id": "task_launch_campaign",
  "prompt": "为秋季发布会生成三套主视觉方向。",
  "upload_session": {
    "session_id": "upload_launch_campaign",
    "status": "OPEN",
    "accepted_mime_types": [
      "image/jpeg",
      "image/png",
      "image/webp",
      "application/pdf",
      "text/plain",
      "text/markdown"
    ],
    "max_files": 20,
    "max_total_bytes": 209715200
  },
  "asset_ids": ["asset_brand_guide"],
  "status": "DRAFT",
  "start_policy": "manual",
  "revision": 1,
  "created_at": "2026-08-22T09:00:00Z",
  "updated_at": "2026-08-22T09:01:00Z",
  "submitted_at": null
}
